,,,,
"","","","",""
"","","","",""
"","","","",""
"","PIAGET BOUTIQUE BAL HARBOUR - SAKS FIFTH AVENUEBal Harbour Shops, 9700 Collins Ave, 33154, Bal HarbourOpen","","",""
"","PIAGET BOUTIQUE BEVERLY HILLS - RODEO DRIVE465 N Rodeo Dr, 90210, Beverly HillsOpen","","",""
"","SHREVE, CRUMP & LOW BOSTON39 Newbury Street, 02116, BostonOpen","","",""
"","PIAGET BOUTIQUE CHICAGO - BURDEENS JEWELRY11 East Walton Street, 60611, ChicagoOpen","","",""
"","PIAGET BOUTIQUE COSTA MESA - SOUTH COAST PLAZA3333, Bristol Street, Suite 2003, South Coast Plaza, 92626, Costa MesaOpen","","",""
"","TIMEVALLEE EAST RUTHERFORD, NEW JERSEY1 American Dream Way, 07073, East RutherfordOpen","","",""
"","SHREVE, CRUMP & LOW125 Greenwich Ave., 06830, GreenwichOpen","","",""
"","PIAGET BOUTIQUE HOUSTON - SAKS FIFTH AVENUEHouston Galleria, 5175, Westheimer Road, 77056, HoustonOpen","ZADOK1801 Post Oak Blvd, Suite 100, 77056, HoustonOpen","",""
"","SAINT CROSSKoreatown Plaza, 928 S Western Avenue, Suite 225, 90006, Los AngelesOpen","","",""
"","LONDON JEWELERS1988 Northern Blvd, 11030, ManhassetOpen","","",""
"PIAGET BOUTIQUE NEW YORK - SAKS FIFTH AVENUE THE VAULTSaks Fifth Ave, 611 5th Avenue, 10022, New YorkOpen","PIAGET BOUTIQUE NEW YORK - HUDSON YARDS20 Hudson Yards, 10001, New YorkOpen","CELLINI430 Park Ave at 56th Street, 10022, New YorkOpen","SIMPSON JEWELERS4922-13th Ave, 11219, BrooklynOpen","CARAT & CO.39-09 Main Street, Flushing, 11354, FlushingOpen"
"","PIAGET BOUTIQUE PALM BEACH150 Worth Avenue, 33480, Palm BeachOpen","","",""
"","NEIMAN MARCUS PALO ALTO400 Stanford Shopping Center, 94304, Palo AltoOpen","","",""
"","RADCLIFFE JEWELERS1819 Reisterstown Road, 21208, PikesvilleClosed","","",""
"","CHONG HING ROWLAND HEIGHTSHong Kong Plaza, 18436 Colima Road, Suite A, 91748, Rowland HeightsOpen","","",""
"","DFS SAIPANBeach Road, Garapan, Northern Mariana Islands, 96950, SaipanOpens at 13.00 (local time)","","",""
"","NEIMAN MARCUS SAN FRANCISCOUnion Square, 150 Stockton Street, 94108, San FranciscoOpen","","",""
"","CHONG HINGSan Gabriel Square, 140 West Valley Blvd, Suite 119, 91776, San GabrielOpen","","",""
"","CH PREMIER JEWELERSWestfield Valley Fair, 2855 Stevens Creek Blvd, Suite 1251, 95050, Santa ClaraOpen","","",""
"","HING WA LEE1569 Fairway Drive, Suite 128, 91789, WalnutOpen","","",""
"","","","",""
"","","","",""